{
  "artifacts": {
    "report.md": "1c9383c040c80948759d5bc0039ad90ebfcc73d91ff31a9ba89bfeec602e8550",
    "trace.html": "5ec314902703ea812b0d0e50c897b20c43ee65b3e77c0a986f8f9d2bef2c88d9"
  },
  "hash": {
    "algorithm": "blake2b",
    "canonicalization": "v1",
    "digest_size": 32
  },
  "provenance": {
    "aggregate_only": true,
    "approved_at": "1970-01-01T00:00:00+00:00",
    "approved_by": "CI",
    "grounding_gate": "pass",
    "model_wrote_numbers": false,
    "narrative_drafter": "deterministic",
    "numbers_bound": 1,
    "numbers_from": "deterministic_sql",
    "numbers_unbound": 0,
    "suppression_applied": true
  },
  "receipts": [
    {
      "caveat": "Client records missing a client_id are dropped before counting, so this figure may slightly undercount clients with incomplete intake data.",
      "collection_frequency": "Continuous, reported quarterly",
      "column_names": [
        "client_id"
      ],
      "computed_at": "1970-01-01T00:00:00+00:00",
      "data_source": "HMIS enrollment records",
      "definition": "Each person enrolled in the housing program during the reporting period, counted once by client_id even if they enrolled more than once. The unit is the person, not the enrollment.",
      "display": "12",
      "indicator": "Number of unduplicated individuals served",
      "kind": "output",
      "metric_id": "clients_served",
      "row_count": 12,
      "slice_hash": "5fb9cf7a45262e7ecb099944819e8605f28a036d084034898fd93edda1f7e01e",
      "suppressed": false,
      "unit": "count",
      "value": 12.0,
      "value_sql": "SELECT COUNT(DISTINCT client_id) FROM data"
    },
    {
      "caveat": "",
      "collection_frequency": "",
      "column_names": null,
      "computed_at": "1970-01-01T00:00:00+00:00",
      "data_source": "",
      "definition": "Enrollments with a recorded exit date. The unit is the enrollment, so a client who exited two enrollments counts twice. A blank exit date is treated as still enrolled, not as an exit.",
      "display": "[SUPPRESSED]",
      "indicator": "",
      "kind": "output",
      "metric_id": "exits",
      "row_count": null,
      "slice_hash": null,
      "suppressed": true,
      "unit": "count",
      "value": null,
      "value_sql": "SELECT COUNT(*) FROM data WHERE exit_date != ''"
    },
    {
      "caveat": "",
      "collection_frequency": "",
      "column_names": null,
      "computed_at": "1970-01-01T00:00:00+00:00",
      "data_source": "",
      "definition": "Exits whose exit_destination is 'permanent'. Destination categories are taken as recorded; an unrecorded destination is not counted as permanent.",
      "display": "[SUPPRESSED]",
      "indicator": "",
      "kind": "output",
      "metric_id": "exits_permanent",
      "row_count": null,
      "slice_hash": null,
      "suppressed": true,
      "unit": "count",
      "value": null,
      "value_sql": "SELECT COUNT(*) FROM data WHERE exit_destination = 'permanent'"
    },
    {
      "caveat": "",
      "collection_frequency": "",
      "column_names": null,
      "computed_at": "1970-01-01T00:00:00+00:00",
      "data_source": "",
      "definition": "Permanent-housing exits divided by all exits in the period, as a whole-number percent. The denominator is exits, not all enrolled clients, so a client still enrolled is not in it.",
      "display": "[SUPPRESSED]",
      "indicator": "",
      "kind": "outcome",
      "metric_id": "pct_permanent",
      "row_count": null,
      "slice_hash": null,
      "suppressed": true,
      "unit": "percent",
      "value": null,
      "value_sql": "SELECT ROUND(100.0 * SUM(CASE WHEN exit_destination = 'permanent' THEN 1 ELSE 0 END) / COUNT(*)) FROM data WHERE exit_date != ''"
    }
  ],
  "schema_version": "2.0"
}
